{
  "id": "VIRO-0010",
  "title": "Autosave large-document quota and write-failure hardening",
  "priority": "P2",
  "domain": "editor-core",
  "state": "ACTIVE",
  "outcome": "Autosave on a large document (many embedded images) can never lose the last good recovery snapshot: quota or write failures are handled explicitly, any user-visible status stays truthful, and the per-tick cost of autosave is measured and reduced (eliminating the double full-document deep-clone per tick) without changing the document schema or recovery file format in a way that breaks existing recovered sessions.",
  "before": "GOVERNOR.md Active Risks and docs/reviews/sprint-critic-01.md (2026-08-26): autosave stores full-document snapshots including embedded image dataURLs in IndexedDB, deep-clones the whole document twice per tick, and large documents can hit quota; the quota/write-failure path is assumed to degrade truthfully but has no test evidence under simulated quota pressure. Builder must re-confirm this before-state on current main (autosave paths in src/app.ts, persistence in src/library/store.ts) before implementing.",
  "after": "A stressed autosave path with a failing or quota-exhausted store keeps the previous good snapshot recoverable, reports truthful status, performs at most one serialization clone per tick, and existing recovery behavior on healthy stores is unchanged.",
  "allowed_paths": [
    "src/app.ts",
    "src/library/store.ts",
    "docs/agents/deliveries/VIRO-0010.json",
    "tests/autosave-*"
  ],
  "depends_on": [],
  "acceptance": [
    "A simulated quota/write failure during autosave leaves the last good snapshot intact and recoverable via the existing recovery path.",
    "Autosave failure surfaces truthful state (no silent false-success); if a status message exists it is exercised by a test.",
    "Serialization deep-clone count per autosave tick is measured before and after; the after state performs at most one clone per tick or documents why not.",
    "Existing recovery tests (tests/recovery.spec.mjs) remain green without modification of their assertions.",
    "npx tsc --noEmit, npm run test:unit (plus new targeted tests), npm run test:chrome and npm run build pass."
  ],
  "evidence": [
    "Targeted test reproducing quota/write failure and proving last-good-snapshot survival",
    "Clone-count or timing measurement before/after",
    "tests/recovery.spec.mjs green run output",
    "npx tsc --noEmit",
    "npm run test:chrome",
    "npm run build"
  ],
  "builder": {
    "status": "PENDING",
    "notes": "Claimable after VIRO-0005 releases the tests/** lease."
  },
  "verifier": {
    "status": "PENDING",
    "notes": "Independent verification required."
  },
  "critic": {
    "status": "NOT_APPLICABLE",
    "notes": "Engine-only persistence hardening; no aesthetic or workflow redesign. Any new user-visible status text must still be shown in verifier evidence."
  },
  "delta": {
    "before": "Autosave deep-clones the full document twice per tick and has untested quota/write-failure behavior.",
    "after": "Single serialization per tick, explicit failure handling, last-good-snapshot survival proven by test.",
    "proof": [],
    "regression_protection": [
      "tests/recovery.spec.mjs assertions unchanged and green"
    ],
    "new_debt": "none yet"
  }
}
